{
  "name": "harness-anchor-local",
  "description": "Local dev marketplace for harness-anchor",
  "owner": {
    "name": "redtropig"
  },
  "plugins": [
    {
      "name": "harness-anchor",
      "description": "Warn-only, zero-dependency runtime harness layer for Claude Code (companion to superpowers): persistent state, scope control (prompt + action side), Default-FAIL verification & coverage gates, entropy governance (golden-rules + drift detection), and first-class C/C++ engineering (CMake/Meson/Make/Bazel + clang-tidy + sanitizers).",
      "version": "0.7.2",
      "source": "./",
      "author": {
        "name": "redtropig"
      }
    }
  ]
}
